{
  "format_version": "1.0",
  "archetype": "A",
  "archetype_confidence": 0.82,
  "shape": "Sequential",
  "shape_phase_count": 4,
  "tool_involvement": "Pipeline calls tools (deterministic)",
  "tool_involvement_variant": "P2",
  "source_runtime": "agent_skills_std",
  "source_runtime_override": null,
  "source_runtime_scores": {
    "agent_skills_std": 3.5,
    "openclaw": 0.5
  },
  "hybrid_threshold_triggered": false,
  "modality": "synchronous_oneshot",
  "modality_confidence": 0.85,
  "secondary_modalities": [],
  "warnings": ["Axis 5 inferred — no explicit modality signals found"],
  "halt": null
}
