{
  "format_version": "1.0",
  "archetype": "D1",
  "archetype_confidence": 0.92,
  "shape": "One-shot",
  "shape_phase_count": 1,
  "tool_involvement": "Pipeline calls tools (deterministic)",
  "tool_involvement_variant": "P2",
  "source_runtime": "agent_skills_std",
  "source_runtime_override": null,
  "source_runtime_scores": {
    "agent_skills_std": 3.5,
    "claude_code": 0.0,
    "openclaw": 0.0,
    "letta": 0.0,
    "crewai": 0.0,
    "langgraph": 0.0,
    "autogen": 0.0,
    "openai_agents_sdk": 0.0,
    "smolagents": 0.0
  },
  "hybrid_threshold_triggered": false,
  "modality": "synchronous_oneshot",
  "modality_confidence": 0.90,
  "secondary_modalities": [],
  "warnings": [
    "Axis 5 inferred — no explicit modality signals found in frontmatter or body"
  ],
  "halt": null
}
